response,Preference general,Preference specific,Character general,Characer specific,Knowledge of area,Location specific,Disposition other,Situation other,
Drew is sporty so wanted to take a longer route,,,1,,,,,,
Harper does not kow the area well so did not take the fastest route,,,,,1,,,,
Jesse doesnt know about the hot dog stand,,,,,1,,,,
brooklyn took the loger route because they are sporty,,,1,,,,,,
taylor is sporty so wated to take a longer route,,,1,,,,2,,
charlie knows the area well so took a short route to the pizza stand,,,,,1,,,,
adrian doesnt know the area well so took a longer route,,,,,1,,,,
He knew the hot dog van was shut.,,,,,,,,1,
They don't know the area well,,,,,1,,,,
He fancied a hot dog and knew the area well.,,1,,,1,,,,
The pizza van was shut,,,,,,,,1,
He was too hungry to explore the area for different foods,,,,,,,1,,is there an implication of lack of knowledge in the area if they want to explore?
The hot dog van was shut,,,,,,,,1,
He wanted some exercise before eating,,,,,,,1,,
He wanted some exercise before eating,,,,,,,1,,
"Adrian doesn't like hot dogs, and got lost walking around the area",1,,,,3,,2,,getting lost as an implication of not knowing the area?
Brooklyn decided to go on a jog and ended up finding the hot dog place.,,,,,,,1,2,are coincidences coded as situation other?
Taylor may have wanted a longer jog so ran past the hot dog place and ended up getting pizza instead.,,,,,,,1,2,
"Parker likes hot dogs, and he was closer to the hot dog place, so was motivated by his laziness and like of hot dogs.",1,,2,,,1,,,
"Jesse didnt know there were hot dogs because they dont know the area well, so chose the option they could see.",,,,,1,2,,,
Drew prefers hot dogs or maybe wanted a longer jog.,1,,,,,,2,,"is preference here general, as there seems to not be an implication of this contrasting with their usual preferences?"
Harper didnt know how to get to the hot dog place so ended up going the long way around.,,,,,1,,,,
Charlie prefers pizza.,1,,,,,,,,
she doesn't know the area well but wanted hot dogs as they're her favourite,1,,,,1,,,,
his favourite food is hot dogs and he wanted some exercise,1,,,,,,2,,
parker wanted pizza and a walk,,1,,,,,1,,
he was hungry and knew the pizza stand was closer,,,,,,2,1,,
Drew prefers hot dogs to pizza,1,,,,,,,,
they prefer hot dogs,1,,,,,,,,same as line 367
brooklyn wanted pizza rather than a hotdog,,1,,,,,,,
adrian thoughts pizza was closest,,,,,,2,1,,
Taylor wanted to exercise,,,,,,,1,,
"Because he knows where the stand is, and hotdogs are his favourite",1,,,,1,,,,
Adrian got lost.,,,,,2,,,1,is getting lost a situational thing or does it reflect lack of knowledge about the area?
simply that he see's a hotdog stand is close,,,,,,1,,,
He likes hotdogs! and maybe is in a rush,1,,,,,,,2,
"Harper doesnt like Pizza, so decided to look for something else",1,,,,,,,,
Jessie fancied a change. Also slightly further away tha hotdog so good for exercise (even though he didnt know),,1,,,2,,3,,good for exercise-- what would that be?
Drew wanted to exercise so took the long route,,,,,,,1,,
They took the longer route as they are sporty,,,1,,,,,,
"Their favourite food is hotdogs, so they went to the hotdogs",1,,,,,,,,
Took the long route as they are sporty and may not like hotdogs,2,,1,,,,,,
initially wanted hotdogs but decided against it,,,,,,,1,,
Doesn't know the area well and so took the shortest route to the pizza that they could already see,,,,,1,2,,,
knew there was pizza there but decided to continue to hotdogs,,,,,,,1,,
don't know the area so took long route to get to hotdogs as they didn't know it was there,,,,,1,,,,
they wanted hotdogs,,,,,,,1,,